{
  "schemaVersion": 1,
  "locale": "zh-CN",
  "source": "docs/design/Minecraft_Biome_Rivals_Prototype_Cards_v0.1.md",
  "entries": [
    {
      "id": "pf_001",
      "nameKey": "card.pf_001.name",
      "name": "蜜蜂",
      "rulesTextKey": "card.pf_001.rules",
      "rulesText": "战吼：为己方英雄恢复 1 点生命。",
      "typeLabel": "生物",
      "rarityLabel": "常见",
      "tagLabels": [
        "节肢",
        "动物"
      ],
      "designNotes": "低费站场与回复基线。"
    },
    {
      "id": "pf_002",
      "nameKey": "card.pf_002.name",
      "name": "放牧绵羊",
      "rulesTextKey": "card.pf_002.rules",
      "rulesText": "掉落：羊毛。",
      "typeLabel": "生物",
      "rarityLabel": "常见",
      "tagLabels": [
        "动物"
      ],
      "designNotes": "标准身材；让击杀与材料产生权衡。"
    },
    {
      "id": "pf_003",
      "nameKey": "card.pf_003.name",
      "name": "驯服的狼",
      "rulesTextKey": "card.pf_003.rules",
      "rulesText": "战吼：若相邻位置有另一个己方动物，获得 +0/+1。",
      "typeLabel": "生物",
      "rarityLabel": "常见",
      "tagLabels": [
        "动物"
      ],
      "designNotes": "教学相邻站位。"
    },
    {
      "id": "pf_004",
      "nameKey": "card.pf_004.name",
      "name": "村民农夫",
      "rulesTextKey": "card.pf_004.rules",
      "rulesText": "战吼：将 1 张“小麦”置入手牌。",
      "typeLabel": "生物",
      "rarityLabel": "稀有",
      "tagLabels": [
        "村民",
        "交易"
      ],
      "designNotes": "村庄、动物和合成的接口。"
    },
    {
      "id": "pf_005",
      "nameKey": "card.pf_005.name",
      "name": "林地苗圃",
      "rulesTextKey": "card.pf_005.rules",
      "rulesText": "每回合第一次召唤己方动物后，使其获得 +0/+1。",
      "typeLabel": "建筑",
      "rarityLabel": "稀有",
      "tagLabels": [
        "植物",
        "生产"
      ],
      "designNotes": "可被攻击的长期成长引擎。"
    },
    {
      "id": "pf_006",
      "nameKey": "card.pf_006.name",
      "name": "繁殖季节",
      "rulesTextKey": "card.pf_006.rules",
      "rulesText": "选择两个共享“动物”标签的己方生物，使其各获得 +0/+1；若有空单位格，再召唤一个 2/2 的“幼年动物”。",
      "typeLabel": "法术",
      "rarityLabel": "稀有",
      "tagLabels": [
        "繁殖",
        "自然"
      ],
      "designNotes": "直接验证繁殖条件和满格边界。"
    },
    {
      "id": "pf_007",
      "nameKey": "card.pf_007.name",
      "name": "林间集结",
      "rulesTextKey": "card.pf_007.rules",
      "rulesText": "召唤两个 2/2 的“林地伙伴”；每因单位格不足少召唤一个，改为抽 1 张牌。",
      "typeLabel": "法术",
      "rarityLabel": "史诗",
      "tagLabels": [
        "自然"
      ],
      "designNotes": "防止满场时完全卡手的中期铺场。"
    },
    {
      "id": "pf_008",
      "nameKey": "card.pf_008.name",
      "name": "铁傀儡",
      "rulesTextKey": "card.pf_008.rules",
      "rulesText": "嘲讽。战吼：若己方控制建筑，获得 +1/+1。",
      "typeLabel": "生物",
      "rarityLabel": "传说",
      "tagLabels": [
        "傀儡"
      ],
      "designNotes": "建筑体系的高费保护者。"
    },
    {
      "id": "db_001",
      "nameKey": "card.db_001.name",
      "name": "尸壳",
      "rulesTextKey": "card.db_001.rules",
      "rulesText": "掉落：腐肉。",
      "typeLabel": "生物",
      "rarityLabel": "常见",
      "tagLabels": [
        "亡灵",
        "僵尸"
      ],
      "designNotes": "侵略性基础生物和掉落教学。"
    },
    {
      "id": "db_002",
      "nameKey": "card.db_002.name",
      "name": "可疑的沙子",
      "rulesTextKey": "card.db_002.rules",
      "rulesText": "掩埋 1 张“陶片”；己方英雄获得 1 点护甲。",
      "typeLabel": "材料",
      "rarityLabel": "常见",
      "tagLabels": [
        "考古",
        "材料"
      ],
      "designNotes": "用即时小收益补偿延迟。"
    },
    {
      "id": "db_003",
      "nameKey": "card.db_003.name",
      "name": "沙漠考古学家",
      "rulesTextKey": "card.db_003.rules",
      "rulesText": "战吼：查看己方牌库顶 3 张牌；若其中有掩埋牌，抽取其中 1 张，其余牌保持相对顺序放回牌库顶。",
      "typeLabel": "生物",
      "rarityLabel": "常见",
      "tagLabels": [
        "村民",
        "考古"
      ],
      "designNotes": "主动挖掘组件。"
    },
    {
      "id": "db_004",
      "nameKey": "card.db_004.name",
      "name": "仙人掌围栏",
      "rulesTextKey": "card.db_004.rules",
      "rulesText": "每回合第一次有敌方生物攻击己方英雄后，对攻击者造成 1 点伤害。",
      "typeLabel": "建筑",
      "rarityLabel": "稀有",
      "tagLabels": [
        "植物",
        "防御"
      ],
      "designNotes": "不使用嘲讽的建筑防御方案。"
    },
    {
      "id": "db_005",
      "nameKey": "card.db_005.name",
      "name": "恶地劫掠者",
      "rulesTextKey": "card.db_005.rules",
      "rulesText": "若本回合己方曾抽到掩埋牌，则本牌费用减少 1。",
      "typeLabel": "生物",
      "rarityLabel": "稀有",
      "tagLabels": [
        "灾厄"
      ],
      "designNotes": "将考古收益转化为节奏。"
    },
    {
      "id": "db_006",
      "nameKey": "card.db_006.name",
      "name": "沙尘暴",
      "rulesTextKey": "card.db_006.rules",
      "rulesText": "对所有生物造成 2 点伤害。",
      "typeLabel": "法术",
      "rarityLabel": "常见",
      "tagLabels": [
        "自然"
      ],
      "designNotes": "对称清场；惩罚过度铺场。"
    },
    {
      "id": "db_007",
      "nameKey": "card.db_007.name",
      "name": "沙漠神殿",
      "rulesTextKey": "card.db_007.rules",
      "rulesText": "战吼：掩埋 1 张“藏宝图”和 1 张“炸药机关”。每当己方掩埋牌完成出土后，为本结构恢复 2 点生命。合成：本结构额外获得 +2 最大生命。",
      "typeLabel": "结构",
      "rarityLabel": "史诗",
      "tagLabels": [
        "结构",
        "考古"
      ],
      "designNotes": "用建筑空间换取两次延迟爆发；作为首个二元支付纵向切片。"
    },
    {
      "id": "db_008",
      "nameKey": "card.db_008.name",
      "name": "商队领头骆驼",
      "rulesTextKey": "card.db_008.rules",
      "rulesText": "战吼：查看己方牌库顶 5 张牌，抽取其中 1 张掩埋牌；若没有，则将 1 张“绿宝石”置入手牌。",
      "typeLabel": "生物",
      "rarityLabel": "传说",
      "tagLabels": [
        "动物",
        "交易"
      ],
      "designNotes": "考古套牌的稳定器，避免完全落空。"
    },
    {
      "id": "si_001",
      "nameKey": "card.si_001.name",
      "name": "雪球",
      "rulesTextKey": "card.si_001.rules",
      "rulesText": "使一个敌方生物本回合获得 -1 攻击力。",
      "typeLabel": "材料",
      "rarityLabel": "常见",
      "tagLabels": [
        "材料",
        "冻伤"
      ],
      "designNotes": "零费材料与小型减攻工具。"
    },
    {
      "id": "si_002",
      "nameKey": "card.si_002.name",
      "name": "雪傀儡",
      "rulesTextKey": "card.si_002.rules",
      "rulesText": "战吼：将 1 张“雪球”置入手牌。",
      "typeLabel": "生物",
      "rarityLabel": "常见",
      "tagLabels": [
        "傀儡"
      ],
      "designNotes": "低攻击防守身材和材料来源。"
    },
    {
      "id": "si_003",
      "nameKey": "card.si_003.name",
      "name": "流浪者",
      "rulesTextKey": "card.si_003.rules",
      "rulesText": "战吼：对一个敌方生物施加“缓慢”。掉落：骨头。",
      "typeLabel": "生物",
      "rarityLabel": "稀有",
      "tagLabels": [
        "亡灵",
        "骷髅",
        "冻伤"
      ],
      "designNotes": "牺牲 1 点身材换一回合节奏。"
    },
    {
      "id": "si_004",
      "nameKey": "card.si_004.name",
      "name": "山羊",
      "rulesTextKey": "card.si_004.rules",
      "rulesText": "战吼：可以将一个相邻己方生物移动到其另一侧的相邻空格；若成功移动，本牌本回合获得 +1 攻击力。",
      "typeLabel": "生物",
      "rarityLabel": "常见",
      "tagLabels": [
        "动物"
      ],
      "designNotes": "位移教学和窄位收益。"
    },
    {
      "id": "si_005",
      "nameKey": "card.si_005.name",
      "name": "北极熊",
      "rulesTextKey": "card.si_005.rules",
      "rulesText": "嘲讽。部署时，若己方英雄生命值不高于 15，本牌获得 +1 攻击力。",
      "typeLabel": "生物",
      "rarityLabel": "稀有",
      "tagLabels": [
        "动物"
      ],
      "designNotes": "控制套牌的中期护卫。"
    },
    {
      "id": "si_006",
      "nameKey": "card.si_006.name",
      "name": "粉雪桶",
      "rulesTextKey": "card.si_006.rules",
      "rulesText": "对一个敌方生物施加“缓慢”；在该状态移除前，它还具有 -2 攻击力。",
      "typeLabel": "法术",
      "rarityLabel": "常见",
      "tagLabels": [
        "冻伤"
      ],
      "designNotes": "控制高攻击目标但不直接解场。"
    },
    {
      "id": "si_007",
      "nameKey": "card.si_007.name",
      "name": "雪屋",
      "rulesTextKey": "card.si_007.rules",
      "rulesText": "己方起始阶段，为一个受伤最重的己方生物恢复 1 点生命；并列时由己方选择。",
      "typeLabel": "建筑",
      "rarityLabel": "稀有",
      "tagLabels": [
        "回复"
      ],
      "designNotes": "迫使对手处理的持续恢复点。"
    },
    {
      "id": "si_008",
      "nameKey": "card.si_008.name",
      "name": "冰刺之巅",
      "rulesTextKey": "card.si_008.rules",
      "rulesText": "敌方生物被召唤到其单位排当前最左或最右的空格时，对其施加“缓慢”。",
      "typeLabel": "结构",
      "rarityLabel": "传说",
      "tagLabels": [
        "结构",
        "冻伤"
      ],
      "designNotes": "用边缘格规则制造可读的区域控制。"
    },
    {
      "id": "cd_001",
      "nameKey": "card.cd_001.name",
      "name": "洞穴蝙蝠",
      "rulesTextKey": "card.cd_001.rules",
      "rulesText": "战吼：查看己方牌库顶牌；可以将其置于牌库底。",
      "typeLabel": "生物",
      "rarityLabel": "常见",
      "tagLabels": [
        "动物"
      ],
      "designNotes": "低费抽牌质量调整。"
    },
    {
      "id": "cd_002",
      "nameKey": "card.cd_002.name",
      "name": "洞穴蜘蛛",
      "rulesTextKey": "card.cd_002.rules",
      "rulesText": "本牌对生物造成普通攻击伤害后，对该生物施加“中毒”。",
      "typeLabel": "生物",
      "rarityLabel": "常见",
      "tagLabels": [
        "节肢"
      ],
      "designNotes": "延迟伤害与净化需求测试。"
    },
    {
      "id": "cd_003",
      "nameKey": "card.cd_003.name",
      "name": "地牢骷髅",
      "rulesTextKey": "card.cd_003.rules",
      "rulesText": "掉落：骨头。亡语：对随机敌方生物造成 1 点伤害；没有敌方生物时不触发。",
      "typeLabel": "生物",
      "rarityLabel": "常见",
      "tagLabels": [
        "亡灵",
        "骷髅"
      ],
      "designNotes": "击杀收益和亡语顺序测试。"
    },
    {
      "id": "cd_004",
      "nameKey": "card.cd_004.name",
      "name": "幽匿感测体",
      "rulesTextKey": "card.cd_004.rules",
      "rulesText": "每个敌方回合，敌方打出其第二张牌后，对敌方玩家施加“黑暗”。",
      "typeLabel": "建筑",
      "rarityLabel": "稀有",
      "tagLabels": [
        "幽匿",
        "深暗"
      ],
      "designNotes": "可被提前处理的行动惩罚。"
    },
    {
      "id": "cd_005",
      "nameKey": "card.cd_005.name",
      "name": "林地卫道士",
      "rulesTextKey": "card.cd_005.rules",
      "rulesText": "战吼：若己方控制建筑，本牌本回合获得 +2 攻击力。",
      "typeLabel": "生物",
      "rarityLabel": "常见",
      "tagLabels": [
        "灾厄"
      ],
      "designNotes": "建筑体系的短时爆发。"
    },
    {
      "id": "cd_006",
      "nameKey": "card.cd_006.name",
      "name": "回响的黑暗",
      "rulesTextKey": "card.cd_006.rules",
      "rulesText": "对敌方玩家施加“黑暗”；抽 1 张牌。",
      "typeLabel": "法术",
      "rarityLabel": "稀有",
      "tagLabels": [
        "深暗"
      ],
      "designNotes": "黑暗机制的最低可用组件。"
    },
    {